,channel_id,video_id,comment_id,date,author,comment_text,sentiment
643,,rHux0gMZ3Eg,UgyUqpGCaWABR5gP5vZ4AaABAg.9TvF-thyhue9Z9J0AsdQ1P,2022-03-04T13:55:57Z,Nakshatra,@Sky Mound This one worked. I had manually added the path but had to restart VScode for it to work. Thanks!,positive
644,,rHux0gMZ3Eg,UgyUqpGCaWABR5gP5vZ4AaABAg.9TvF-thyhue9YWU4OlyAdw,2022-02-16T17:23:47Z,Exequiel Herrera,You need to add only /bin (not /bin/python). That's work for me in Mac,neutral
645,,rHux0gMZ3Eg,UgwFTxGmePoDfL8Joct4AaABAg,2021-10-24T09:58:45Z,Chris Mains Math,hmmm...I don't find the command palette...someone help pls...,neutral
646,,rHux0gMZ3Eg,Ugx2WA0J5-PISlQGPEx4AaABAg,2021-10-24T04:50:21Z,Tech Upskill,Thank you Mosh ❤️,neutral
647,,rHux0gMZ3Eg,UgznueLTejTmGj7MocJ4AaABAg,2021-10-23T19:08:28Z,Rohit Hemant,Hey Mosh Which Software Do You Use For Animations? 🤔🤔,neutral
648,,rHux0gMZ3Eg,Ugy9eBNDfplUvRDITgx4AaABAg,2021-10-22T17:52:33Z,sxmizaman,how to make my mac terminal lool like yours?,neutral
649,,rHux0gMZ3Eg,UgweBwXs2kCuN3CMqPl4AaABAg,2021-10-22T12:33:47Z,Borhan uddin,Setup process Not working in Windows 10,neutral
650,,rHux0gMZ3Eg,Ugzsx-hFBP_ieNakR-l4AaABAg,2021-10-22T07:11:59Z,kevin tanudjaja,"stuck in minute 16, no module named django when runserver",neutral
651,,rHux0gMZ3Eg,UgxXQ5ZAn7-WQ0Pb0V94AaABAg,2021-10-22T02:01:00Z,UnknownShayBra,"my pipenv is not working it says: 'pipenv' is not recognized as an internal or external command,
operable program or batch file.",neutral
652,,rHux0gMZ3Eg,UgwPtKQmDI_UcB-qA-N4AaABAg,2021-10-19T17:49:01Z,Ibrahim,"Sir, please make a css course.",neutral
653,,rHux0gMZ3Eg,Ugzw-BbJz74-uUoW0O14AaABAg,2021-10-19T13:04:53Z,lifeofphai,"If you are having issue getting the debug panel to appear put this into your settings.py file then clear your browser cache.
""if DEBUG:
    import mimetypes
    mimetypes.add_type(""application/javascript"", "".js"", True)""",positive
654,,rHux0gMZ3Eg,UgyG4BwKCOtQ5u6wR9t4AaABAg,2021-10-19T04:19:53Z,Ranel Labjata,What a Legend! ❤️,neutral
655,,rHux0gMZ3Eg,Ugy4QK0fyKQJXH49fyl4AaABAg,2021-10-18T18:50:39Z,Coder Kid,Nice Content,positive
656,,rHux0gMZ3Eg,Ugwdv_crjHTi5czBs-B4AaABAg,2021-10-18T12:06:06Z,Prince Humpry,"_my bookmark_
11:35",neutral
657,,rHux0gMZ3Eg,Ugx2f6-9WaBZvVO8z_x4AaABAg,2021-10-18T09:44:04Z,Saad Ahmed,Please teach us PROGRAMMING in MOBILE PHONE🥺🥺🥺🙏🙏🙏,neutral
658,,rHux0gMZ3Eg,UgwlJG6MYbUdsD2JtQl4AaABAg,2021-10-16T19:10:35Z,Ae Bek,"i wish that paypal and mastercard works in ethiopioa and purchase the courses that you teach .
i read your story on your website it motivates me to learn better and taught me that grades dont matter",positive
659,,rHux0gMZ3Eg,UgziuGXK0AslVSv01kN4AaABAg,2021-10-16T15:37:13Z,Cube Dev,Please make Vuejs,neutral
660,,rHux0gMZ3Eg,UgyzEDHqPoJoa3PbijN4AaABAg,2021-10-16T13:34:35Z,mahmood alizadeh,I'm so appreciate. It was very usefull for me. :),positive
661,,rHux0gMZ3Eg,UgxCb25BeCRX2PUNciJ4AaABAg,2021-10-16T05:19:32Z,Mohsin Gamer,Good luck 🤞🤞🤞,positive
662,,rHux0gMZ3Eg,UgzwEsee_iEpV20sF8x4AaABAg,2021-10-15T23:18:29Z,Yeasin Arafat.,"In my machine, I am using windows 64bit. Here, when I am going to create folder besides project. But the Command ls(LS)is not working. I can't create Pipfile and Pipfile.lock.What should I do?",neutral
663,,rHux0gMZ3Eg,UgwXe5GjBheSNUlYImZ4AaABAg,2021-10-15T07:08:38Z,ajit pakaria,Sir every time when I write any programme in pycharm in Python programming it only shows the first programme so what can I do.if you are unable to understand this so please tell me I will make it more clear,positive
664,,rHux0gMZ3Eg,Ugx1jfbvZRA_aI6RAM54AaABAg,2021-10-14T19:47:13Z,David Santiago Galván,"Thank you a lot Mosh! I wasn't learning great Django, but I see this video, and I understand 100% Thank you very much 💯💻",positive
665,,rHux0gMZ3Eg,UgycsYEymdYl4mCI5vR4AaABAg,2021-10-14T01:09:59Z,Natasha,A flutter course would be amazing,positive
666,,rHux0gMZ3Eg,UgzRJFElNpQ3cFbdYCh4AaABAg,2021-10-13T15:13:26Z,Filigs,"this guy... If i didn't receive such a little salary id donate to you, you've helped me alot",negative
667,,rHux0gMZ3Eg,UgwWh1uXLgipN3136Rh4AaABAg,2021-10-13T11:22:39Z,Yakhyobek Mamadaliyev,"THANK YOU ""MOSHI MOSHI"" 🥳🥳🥳",neutral
668,,rHux0gMZ3Eg,Ugy9eUeKW5E7iuef3d14AaABAg,2021-10-13T01:11:18Z,Mostafa Ispareh,where are you mosh? pa to koojai,neutral
669,,rHux0gMZ3Eg,UgykS_aagXdVUpXJHyN4AaABAg.9TP50f77MaU9TP5ok0tGcZ,2021-10-12T14:00:09Z,Water,"(Edit): I made the folder myself and the settings.json myself and it now works I think.
With the new version of python it told me to put this one instead of the old line just replace ""folder"" with your path

{
    ""python.defaultInterpreterPath"": ""folder""
}",positive
670,,rHux0gMZ3Eg,UgzT1QJOpnWNGt9Vw3t4AaABAg,2021-10-12T12:24:47Z,Mickey,"Brother DO YOU TEACH COMPLETE COURSES  FOR FREE, OR YOU HAVE PAID COURSES? PLZ REPLY_/\_",positive
671,,rHux0gMZ3Eg,UgwHzZ_h1Onx7p4kZ_N4AaABAg.9TOjQPGfpAC9o83excOrRg,2023-04-05T18:44:55Z,Khaled athmani,Thank u men,neutral
672,,rHux0gMZ3Eg,UgwHzZ_h1Onx7p4kZ_N4AaABAg.9TOjQPGfpAC9liM42iiFwi,2023-02-04T16:43:29Z,Mann Jain,"after selecting the interpreter, it is not showing a extra directory named vs code as shown in video. is it fine? should i go ahead or i have done some mistake?",positive
673,,rHux0gMZ3Eg,UgwHzZ_h1Onx7p4kZ_N4AaABAg.9TOjQPGfpAC9lPqBxXMPqH,2023-01-28T02:50:38Z,spianny,i love you,positive
674,,rHux0gMZ3Eg,UgwHzZ_h1Onx7p4kZ_N4AaABAg.9TOjQPGfpAC9kf3kNCBKiw,2023-01-09T13:34:15Z,Maira Usman,can i know what should i do in linux,neutral
675,,rHux0gMZ3Eg,UgwHzZ_h1Onx7p4kZ_N4AaABAg.9TOjQPGfpAC9kFkNC-aXVK,2022-12-30T08:15:56Z,PRIYANKA ARDU,@Glenn thanks : ),positive
676,,rHux0gMZ3Eg,UgzOOesuo8bxU8pJmpJ4AaABAg,2021-10-12T02:24:59Z,School Of Happiness,"For windows 10 OS, python version check command is:
py --version",neutral
677,,rHux0gMZ3Eg,UgxoXlknKBEkR0Gyi294AaABAg,2021-10-11T15:03:40Z,SS Rot,"hey man, its not creating the  .vscode after i enter the python interpreter path like at  20:15. would appreciate your help",neutral
678,,rHux0gMZ3Eg,Ugx-NXsb5lgrF8vKkkN4AaABAg,2021-10-11T12:43:19Z,Saida Bami,"Thank you for your course its really helpful, is there the next course about create models ?",positive
679,,rHux0gMZ3Eg,UgxjnZ1ptHRX0pfH4F54AaABAg,2021-10-11T12:21:51Z,Chris S,This amazing feeling when you see only errors in the browser and then Boom suddenly it works. So satisfying. Thank you Mosh. I think in December I'll buy your full course on Django.,positive
680,,rHux0gMZ3Eg,Ugw7Tfrjib88fqfP3I14AaABAg,2021-10-10T08:59:58Z,PUBG GAMERZONE,Please make a course on java gui or access database using java,neutral
681,,rHux0gMZ3Eg,Ugy_u8vDa1oGJQszbCJ4AaABAg,2021-10-09T23:45:59Z,gurushanmuga,"I am new to django and I have gone through couple of other paid courses in before this. Most of them are plain academic in nature, none of them will come close to the explanations provided by Mosh.",positive
682,,rHux0gMZ3Eg,Ugx6ojZMuxXrv0w4Uxx4AaABAg,2021-10-09T04:17:08Z,Programs with Umair,Where is your BACKEND guide video???,neutral
683,,rHux0gMZ3Eg,UgwKhZBiIVbGtY4NUbB4AaABAg,2021-10-09T03:34:02Z,WLT,"Hi Mosh ! I have a question.
What language does use Forex trading ?
It can be used automatic trading with expert advisors(EA) aka robot. Can programmer know what will be the direction or movement of price action with your programming? Thanks a lot Mosh !",positive
684,,rHux0gMZ3Eg,Ugwub43R51Pqmd6Guox4AaABAg,2021-10-08T13:02:31Z,Dilmi Dilshara,can you create a tutorial about how to make mobile based LAN monitoring & controlling app..... thank you!!!,neutral
685,,rHux0gMZ3Eg,Ugx94i2Ct2RlVyri0ix4AaABAg,2021-10-08T10:58:19Z,Olga Ivanova,"Hey Mosh, what extension do you use to customize your terminal so that it shows the path and the git branch?",neutral
686,,rHux0gMZ3Eg,Ugw2nWE9w1BLTZsdSEV4AaABAg,2021-10-08T00:05:35Z,Listen Al Quran,Very first-class motion pictures team ..I lately determined your channel.incredible dessert ...,negative
687,,rHux0gMZ3Eg,UgyR2R_R3kcXD2MZTl54AaABAg,2021-10-06T21:39:34Z,Eminem-Music,Are from Iran?,neutral
688,,rHux0gMZ3Eg,Ugw9eKn2sTGEx0c0HMN4AaABAg.9T8tJ3Qjkya9TAFlSjitGF,2021-10-06T19:38:28Z,Williams smith,☝️☝️I appreciate this dude for his awesome work he did ..,positive
689,,rHux0gMZ3Eg,Ugzs7m4LOSX2uTPVS8B4AaABAg.9T6eGwceTZa9TAFw9GQUDc,2021-10-06T19:39:56Z,Williams smith,☝️☝️☝️☝️☝️I appreciate this dude for his awesome work he did ..Helped me with python,positive
690,,rHux0gMZ3Eg,UgwcuUuxlb0QE_1B-L14AaABAg,2021-10-05T08:53:48Z,Sheraz Razzaq,"Salute to one of my Favorite Teacher. You always teach in different style and I am a big fan of that style.❣️
 Happy Teachers Day❣️",positive
691,,rHux0gMZ3Eg,UgzLm-sWiDVuPgSBpWp4AaABAg,2021-10-05T06:51:55Z,Saijivan Maheswaran,Any cool dart / flutter tutorial recommendations guys? :D or even an tuturial idea @mosh,positive
692,,rHux0gMZ3Eg,Ugw5qxqXXtPE35-Hy_Z4AaABAg.9T4ca87yCWu9TAG-IhF62u,2021-10-06T19:40:30Z,Williams smith,☝️☝️I appreciate this dude for his awesome work he did ..Helped me with python,positive
693,,rHux0gMZ3Eg,Ugx58HqoPytzfb8U9M54AaABAg,2021-10-04T14:39:28Z,Yousif Alshnawa,THANK YOU SO MUCH I JUST SUBCRIBED,positive
694,,rHux0gMZ3Eg,UgwoI-QSdsCusR8L85F4AaABAg,2021-10-03T09:10:51Z,mk,Please make a video on kotlin,neutral
695,,rHux0gMZ3Eg,UgwCLKNliQkk7CfA6KZ4AaABAg,2021-10-03T00:57:04Z,Karanvir Sidhu,"If all the courses you produce are on YouTube, should I still consider subscribing to your, ""coding with mosh"" program on your website?",neutral
696,,rHux0gMZ3Eg,UgwD_UpXNy3OUmjN9Yt4AaABAg,2021-10-02T16:15:22Z,Trigon,Hats off to you how you cover the 1 hour topic into one minute 🙏🙏,neutral
697,,rHux0gMZ3Eg,UgxvJ9usRwiX_Mgvh654AaABAg,2021-10-02T16:13:28Z,Trigon,I am very happy to see that course but i am curious when you will release the comprehensive course of machine learning?,positive
698,,rHux0gMZ3Eg,UgzkKWKyZOsXMoR3w-l4AaABAg,2021-10-02T15:34:04Z,beatalert,"The end of the course is BS. Basically I ended up watching a 1 hour tutorial of fluff trying to sell your full course.Models should have been covered in this tutorial, you had an hour",positive
699,,rHux0gMZ3Eg,Ugwb-TeV3n_DbQ1ha6h4AaABAg,2021-09-30T16:14:06Z,Lets Get,"hi mosh good day 
i cant find any binary in the virtual environment am using a mac book",positive
700,,rHux0gMZ3Eg,UgwI4qyldl2oedzK79Z4AaABAg,2021-09-30T15:46:14Z,rupesh kunwar,"Mosh as you are the avatar of the programming
Mastering all the essential elements (c#, JavaScript and python)
And their respective Frameworks (Asp.net core, node and Django)

Can you please make a comparison videos off all these..!?

As no one can do this better than you. :)

Will help in choosing career path to all the beginner out there... :)",positive
701,,rHux0gMZ3Eg,UgwiGekeOuXR4i7du7Z4AaABAg,2021-09-29T17:45:34Z,Shreyansh Shreshtha,Can I use Xcode?,neutral
702,,rHux0gMZ3Eg,UgxAQ0Nmmbm0C-6uCOR4AaABAg,2021-09-28T17:05:46Z,Mordecai Gaza,God bless you Sir for all the contents you deliver 😍😍 I pray he would reward you greatly much love.,positive
703,,rHux0gMZ3Eg,UgzTNKSSk6aNlhS-zP94AaABAg,2021-09-27T22:41:57Z,FrontRunner Cars,"You're the best online tutor have ever met, Your Free courses are always fantastic and insightful. THANKS BOSS!",positive
704,,rHux0gMZ3Eg,UgzwUgycDII-WutrBdF4AaABAg,2021-09-27T17:39:53Z,Rayan Arif,I am having errors using pipenv install django.,neutral
705,,rHux0gMZ3Eg,Ugxgw3N4tVk7B7EelRh4AaABAg,2021-09-27T15:33:38Z,shakti yadav,DJANGO IN 1 HOUR im leaning django for a year  still not know many things,positive
706,,rHux0gMZ3Eg,UgzktcOPpWmR3_0Beqt4AaABAg,2021-09-27T06:15:35Z,Mindmaster,"Would just like to say that you have a gift for simplifying and translating complexity into something easily digestible. I've tried to learn Django a few times and given up because of the hodge-podge of models, views, and whatever not being clearly explained enough to where I could see how they are glued together. Mind you, I understand React, JS, and other frameworks just fine, but Django is just 'different' from the others and I wasn't getting it. Even with this little 1hr sampler I probably understand it at least 2x as much, thanks!",positive
707,,rHux0gMZ3Eg,UgxUI-4u8NUE-Y-bDqx4AaABAg,2021-09-26T10:54:19Z,Ahmed Khair,"Sir you are the best person on YouTube, I learned a lot from you, but I have a question I don't have a college degree and I wanna work as a front end developer in Sweden, what I can do please step by step ?",positive
708,,rHux0gMZ3Eg,UgxWg9vmWtFA3CpQdZB4AaABAg,2021-09-26T02:44:23Z,Every Thing,"سلام خدمت شما،
از شما یک خواهش داشتم
به زبان انگلیسی خیلی آموزش های برنامه نویسی هم رایگان هم پولی وجود داره اما به زبان فارسی خیلی کم است ایجور آموزش ها لطفا به زبان فارسی هم تدریس کنید",neutral
709,,rHux0gMZ3Eg,UgzaHpMf_9qPlxmjjAF4AaABAg,2021-09-25T09:18:26Z,Ged,does anyone know why i cannot use the integrated terminal in VSC? the .vscode just doesnt appear,neutral
710,,rHux0gMZ3Eg,UgzPfzkz8wiDtLTsgy94AaABAg,2021-09-24T18:58:42Z,Bingi Rajkumar,"in that link it showing part 1 and contains only 5hrs 
remaining 5hrs?",neutral
711,,rHux0gMZ3Eg,UgwBZDTVbsxWCrCiP9B4AaABAg,2021-09-24T09:37:27Z,Nirmal Kumar,"Hey Mosh , Excellent tutorial . Can we get a part 2 continuation for creating models.",positive
712,,rHux0gMZ3Eg,UgwZEGe3c5WWY4TZTYN4AaABAg,2021-09-23T11:34:50Z,"Scivnce ,",Hi mosh i love your videos! Could you make a new c# crash course. The last one was 5 years ago and alot has changed. Thank you for these amazing  videos 💜💜💜💜,positive
713,,rHux0gMZ3Eg,UgwaleDlZXUe0E_7ThV4AaABAg,2021-09-22T13:41:46Z,Harryj Potter,Plz .... release a full course on machine learning.....,positive
714,,rHux0gMZ3Eg,UgyhobwT9c7HxDZPl1R4AaABAg,2021-09-21T06:55:41Z,Harshavardhan Venkata Sai Kotu,I have a problem with this in windows  (Using the Integrated Terminal in VSCode) I can't find the path or \scipts \python is not working can anyone please help me,neutral
715,,rHux0gMZ3Eg,UgzbNuSahB_t8xq2zdB4AaABAg,2021-09-21T02:55:55Z,Daniel A,when are you releasing the second part of this course?,neutral
716,,rHux0gMZ3Eg,UgxzqIKkvuEpwIPKQOJ4AaABAg,2021-09-20T16:18:59Z,rahman Lutfar,Love From Bangladesh 🧡🇧🇩,positive
717,,rHux0gMZ3Eg,Ugz_6FkQ8YeU-GQYSg14AaABAg,2021-09-20T04:54:33Z,Jesus Gutierrez,"I don't understand english, but i really want to learn  this technology!!",positive
718,,rHux0gMZ3Eg,UgxZZqYhORn-WA7U_Nx4AaABAg,2021-09-20T04:42:32Z,Lesego Euratius Modiane,"pipenv install django doesn't work on my pc, says command is not recognized",neutral
719,,rHux0gMZ3Eg,Ugy27tclE994S3WeGGt4AaABAg.9SUEfM3OyfH9SiYuhjZepW,2021-09-25T16:07:47Z,Math with Andy,@Ged Yeah but there’s only Launch.json in there,neutral
720,,rHux0gMZ3Eg,Ugy27tclE994S3WeGGt4AaABAg.9SUEfM3OyfH9ShpOZp9h3u,2021-09-25T09:21:18Z,Ged,does .vscode appear for you?,neutral
721,,rHux0gMZ3Eg,UgyTrbWHcAO01vWKauB4AaABAg,2021-09-19T11:26:05Z,eshetu gusare,great!,positive
722,,rHux0gMZ3Eg,Ugxf8GWN7k0whw4PePB4AaABAg,2021-09-19T07:50:09Z,WalkPedia,"I,m following the steps but i when i past the path into the python inter , I do not see the vscode. settings.json?
can anyone help please?",negative
723,,rHux0gMZ3Eg,UgxtP3YpTWoLZpUc2Xp4AaABAg,2021-09-18T14:56:32Z,Abhay Tiwari,Mosh i have started my coding journey in 9th grade with your python videos to be honest your video are so good,positive
724,,rHux0gMZ3Eg,Ugw90Bwl-lJOhw6JOw14AaABAg,2021-09-17T13:58:54Z,Mansoor Ali,".vscode directory is not creating, can anyone please help?",neutral
725,,rHux0gMZ3Eg,UgyjPmGQUP2sJ6ImJ754AaABAg,2021-09-17T03:29:22Z,Albert F Sumo,I haven't watch this video yet but as long it's mosh teaching than I know I won't be wasting my time,negative
726,,rHux0gMZ3Eg,Ugz8TDY0s-OPiTRm7CJ4AaABAg,2021-09-16T17:21:08Z,Daniel Baffoe,i did not get any vscode folder with the settings file,neutral
727,,rHux0gMZ3Eg,UgxtVL_Y9AHASIfXki94AaABAg.9SKVTVn0_Y59SxW8E7FSv1,2021-10-01T11:32:10Z,Mohammad Umair,"Cat but you can't really make games with python I mean it's not ideal to do so, but only if you are gonna use gscript which has a flavor of python",negative
728,,rHux0gMZ3Eg,UgxtVL_Y9AHASIfXki94AaABAg.9SKVTVn0_Y59Swv01Moy1M,2021-10-01T05:59:00Z,skippo,Cat thanks,positive
729,,rHux0gMZ3Eg,UgxtVL_Y9AHASIfXki94AaABAg.9SKVTVn0_Y59SOVCMMUw8Z,2021-09-17T11:51:20Z,Mohammad Umair,what do you wanna do with python in the first place?,positive
730,,rHux0gMZ3Eg,UgxVoNexACZ4yJPQ7Bh4AaABAg,2021-09-15T10:58:30Z,Ansh Sharma,From more than 2 months no course is coming!!😕😫 I am so sad about it.,neutral
731,,rHux0gMZ3Eg,UgxM-IrFcxsaX4F3kz94AaABAg,2021-09-15T09:27:59Z,Poovaragavan,In duration 20.17 mins I don't get that . vscode how's that file goes over there....?,neutral
732,,rHux0gMZ3Eg,UgzHYkFcobKpRbFMJ3F4AaABAg,2021-09-15T03:57:50Z,Floherca C.A.,"Error 1006: Access Denied
What happened? I dont can acces your website! This is very bad :-(",negative
733,,rHux0gMZ3Eg,UgywOA7AaJQXG0myXzJ4AaABAg.9SHpXe0N2N-9UBI8umj4Qc,2021-11-01T01:49:55Z,Brian S,@Ged took me a couple of minutes in case anyone else here got stuck: open powershell as admin and type in Set-ExecutionPolicy RemoteSigned and type Y afterwards,neutral
734,,rHux0gMZ3Eg,UgywOA7AaJQXG0myXzJ4AaABAg.9SHpXe0N2N-9ShpY4381u_,2021-09-25T09:22:36Z,Ged,how do you fix this though,neutral
735,,rHux0gMZ3Eg,UgzMNuXzLj8EvIIHtcF4AaABAg,2021-09-14T12:04:54Z,Richard Greville,Very clear and concise!,positive
736,,rHux0gMZ3Eg,Ugwo_wzZQwuzv90iXVN4AaABAg,2021-09-13T18:37:35Z,Maroun Hajj,"Hello Mr Mosh. I am getting an error after the url mappings section. The browser is returning ""using the urlconf defined in storefront.urls,Django tried these Url patterns, in this order:
1.admin/
2.playground/
The empty path didn't match any of these"". Can you help me please to solve this problem? Thank you in advance",negative
737,,rHux0gMZ3Eg,UgxsO7-RB5wGkSv9M0p4AaABAg,2021-09-13T17:32:33Z,Shakirah Owolabi,"Please Coach Mosh, can you make a video on front end vs back end vs full stack development, what it takes and which you advice people to go into",positive
738,,rHux0gMZ3Eg,UgwxlqaHLvGRZ3RcKvF4AaABAg,2021-09-13T16:15:17Z,Muhammad Ashfaq,"Totally waste of time. Are you explaining the theory..!! come on man
Why not do some code",negative
739,,rHux0gMZ3Eg,Ugxnjgg3yfKJcyRy5fN4AaABAg,2021-09-13T14:04:18Z,ESS,"Im interested in taking your python course sir 
Can I know how many can use it at a time",positive
740,,rHux0gMZ3Eg,UgzN5YGiIA1888fow214AaABAg,2021-09-13T11:11:32Z,VEERESH PATEL,"Bro please do latest (2021) crash course on 
1.Angular 12
2- reactjs
3- nodejs-
4-- meanstack
5.mern stack
6-Real time project (product) development",positive
741,,rHux0gMZ3Eg,UgzjpHDIEYGRUWBVQ3V4AaABAg,2021-09-11T21:53:33Z,BluJay,Can you make a Android Studios Tutorial please,neutral
742,,rHux0gMZ3Eg,Ugy0LJTtmJO2Jrv259F4AaABAg,2021-09-11T11:23:23Z,陈闹,I really like the background sound in the guide animation. Does anyone know its name or where can I download it from?,positive
743,,rHux0gMZ3Eg,UgxijyvKhg5_ynxV7Jx4AaABAg,2021-09-11T09:32:47Z,Hamza Waseem,sir I am having a problem in opening server on browser can you help me,neutral
744,,rHux0gMZ3Eg,UgxNAaJ9iprNPrLsMZV4AaABAg,2021-09-11T05:03:07Z,MainKt,Which theme is he using,neutral
745,,rHux0gMZ3Eg,Ugy2AZIie25Vla91Oe54AaABAg,2021-09-10T22:52:24Z,Leeeon Y,Any ETA for part 2???,neutral
746,,rHux0gMZ3Eg,Ugyj8g4wxK2wpluot0p4AaABAg,2021-09-10T08:33:37Z,Buddika Dissanayake,so much useless water! waste of time.,negative
747,,rHux0gMZ3Eg,Ugy1tjysDgumtDxyTxx4AaABAg,2021-09-10T01:25:35Z,Samson Mayeem,"How about this one? 
https://youtu.be/QgnVri0aHmU",neutral
748,,rHux0gMZ3Eg,Ugx7lRiI5CdOJLQoIIN4AaABAg,2021-09-09T19:28:52Z,AmirH Mahmoodi,"I'm waiting for second part, where's it👶👶👶👶",neutral
749,,rHux0gMZ3Eg,Ugyy5euKioHUL12ykxZ4AaABAg.9S3q1bmPUtH9S4UNo57SnZ,2021-09-09T17:19:20Z,Patricia Smith,Yeah he is trusted ❤️,neutral
750,,rHux0gMZ3Eg,Ugyy5euKioHUL12ykxZ4AaABAg.9S3q1bmPUtH9S3vvTiBQbd,2021-09-09T12:09:30Z,CRAMIN_TECH on instagram,👆👆All thanks for👆👆🔝he helped me  achieved my own python 3 programming course certificate and am very glad to have my own certificate  he teaches well thanks so much 🥰,positive
751,,rHux0gMZ3Eg,UgwirhilOhDPI-1MShF4AaABAg.9S3lK5GXIcz9S4UXIwIWkw,2021-09-09T17:20:38Z,Patricia Smith,Yeah he’s trusted ❤️,neutral
752,,rHux0gMZ3Eg,UgwirhilOhDPI-1MShF4AaABAg.9S3lK5GXIcz9S3vxPWsLLK,2021-09-09T12:09:46Z,CRAMIN_TECH on instagram,👆👆All thanks for👆👆🔝he helped me  achieved my own python 3 programming course certificate and am very glad to have my own certificate  he teaches well thanks so much 🥰,positive
753,,rHux0gMZ3Eg,UgySOy-DeoASEhr2Dsh4AaABAg.9S37WyzjjX99S4UcqJil4f,2021-09-09T17:21:32Z,Patricia Smith,I also achieved my God bless him 🥰,neutral
754,,rHux0gMZ3Eg,UgySOy-DeoASEhr2Dsh4AaABAg.9S37WyzjjX99S4THdTgSiE,2021-09-09T17:09:46Z,CRAMIN_TECH on instagram,👆👆All thanks for👆👆🔝he helped me  achieved my own python 3 programming course certificate and am very glad to have my own certificate  he teaches well thanks so much 🥰,positive
755,,rHux0gMZ3Eg,UgygvR3N8BZUkbhxGst4AaABAg.9S1XnNZ-2_19S4Uiz2poIF,2021-09-09T17:22:22Z,Patricia Smith,Yeah he help me aslo🥰😍,neutral
756,,rHux0gMZ3Eg,UgygvR3N8BZUkbhxGst4AaABAg.9S1XnNZ-2_19S4TQDCIZm-,2021-09-09T17:10:56Z,CRAMIN_TECH on instagram,👆👆All thanks for👆👆🔝he helped me  achieved my own python 3 programming course certificate and am very glad to have my own certificate  he teaches well thanks so much 🥰,positive
757,,rHux0gMZ3Eg,UgzsiU4CMhXOfNGqe-V4AaABAg,2021-09-08T08:10:48Z,Afan Cvk,"Semoga bisa tembus 1k subscriber di bulan ini, 
Link mediafire nya masih anget 
LANGSUNG INTIP MAMPIR AE 🤭🤭",neutral
758,,rHux0gMZ3Eg,UgzqcJFotxht75jqUit4AaABAg,2021-09-08T06:45:45Z,SHRI DHANUSH AM IITM CSE,Great going and thank u very much brother.. Do continue 🤩🥳,positive
759,,rHux0gMZ3Eg,UgwL0ftMWoXIJ5b6EqB4AaABAg.9S0ePwzZOc49S4Uq8u_kht,2021-09-09T17:23:21Z,Patricia Smith,He also helped me 🥰🥰🥰  I own him a big thanks 🥰,positive
760,,rHux0gMZ3Eg,UgwL0ftMWoXIJ5b6EqB4AaABAg.9S0ePwzZOc49S3w4Uozr4L,2021-09-09T12:10:52Z,CRAMIN_TECH on instagram,👆👆All thanks for👆👆🔝he helped me  achieved my own python 3 programming course certificate and am very glad to have my own certificate  he teaches well thanks so much 🥰,positive
761,,rHux0gMZ3Eg,UgyS2bVfahs5LzZeoeJ4AaABAg.9Ry6rcEdvqD9S4V4PSiYmq,2021-09-09T17:25:26Z,Patricia Smith,Thanks to him once again he helped me also God bless him 🥰🥰❤️,positive
762,,rHux0gMZ3Eg,UgyS2bVfahs5LzZeoeJ4AaABAg.9Ry6rcEdvqD9S3wFRs9czv,2021-09-09T12:12:22Z,CRAMIN_TECH on instagram,👆👆All thanks for👆👆🔝he helped me  achieved my own python 3 programming course certificate and am very glad to have my own certificate  he teaches well thanks so much 🥰,positive
763,,rHux0gMZ3Eg,UgxBtMDjyiCo2u7yoPJ4AaABAg,2021-09-05T22:59:47Z,David,Holy shit this was free!? Bro this is craazzzyyy good. wtf,positive
764,,rHux0gMZ3Eg,UgzHz2qlo2t5_W67ext4AaABAg.9RvCKR6UL-z9S4VCs3SLUr,2021-09-09T17:26:35Z,Patricia Smith,Thanks once again to him he helped me also I own him a big thanks 🥰🥰,positive
765,,rHux0gMZ3Eg,UgzHz2qlo2t5_W67ext4AaABAg.9RvCKR6UL-z9S4TWLh-DTy,2021-09-09T17:11:46Z,CRAMIN_TECH on instagram,👆👆All thanks for👆👆🔝he helped me  achieved my own python 3 programming course certificate and am very glad to have my own certificate  he teaches well thanks so much 🥰,positive
766,,rHux0gMZ3Eg,Ugw-Dpz2SnZ1a3gGMb14AaABAg.9RvC8gKeBjh9S4VKjAK76B,2021-09-09T17:27:40Z,Patricia Smith,He help me also 🥰👆,neutral
767,,rHux0gMZ3Eg,Ugw-Dpz2SnZ1a3gGMb14AaABAg.9RvC8gKeBjh9S4TYwkorqC,2021-09-09T17:12:07Z,CRAMIN_TECH on instagram,👆👆All thanks for👆👆🔝he helped me  achieved my own python 3 programming course certificate and am very glad to have my own certificate  he teaches well thanks so much 🥰,positive
768,,rHux0gMZ3Eg,Ugy5kphrSsEWppnXb0J4AaABAg.9RvC8TlNdqS9S4VPyVkMcl,2021-09-09T17:28:22Z,Patricia Smith,Whoa thanks to him 🥰🥰🥰❤️I achieved my aslo,positive
769,,rHux0gMZ3Eg,Ugy5kphrSsEWppnXb0J4AaABAg.9RvC8TlNdqS9S4TdBzVASt,2021-09-09T17:12:50Z,CRAMIN_TECH on instagram,👆👆All thanks for👆👆🔝he helped me  achieved my own python 3 programming course certificate and am very glad to have my own certificate  he teaches well thanks so much 🥰,positive
770,,rHux0gMZ3Eg,UgyW8-OnGdCYqmjzlnx4AaABAg.9Rv7olPRse29RxKPl20vFc,2021-09-06T13:18:18Z,Susyamal Dev,And I made one myself,neutral
771,,rHux0gMZ3Eg,UgwDF-9bmk_OJuB7ulZ4AaABAg,2021-09-05T12:21:40Z,for YouTube,Happy Teachers Day Mosh!❤️,positive
772,,rHux0gMZ3Eg,Ugx8GzGY1lfx3ti4TdB4AaABAg.9RsOJRxkAA_9RvqIRmjJcd,2021-09-05T23:27:11Z,SHAHAD HUSSEIN,"@Athiran   I named it the same as mosh and you, it's right",positive
773,,rHux0gMZ3Eg,Ugx8GzGY1lfx3ti4TdB4AaABAg.9RsOJRxkAA_9RvUTtqhU04,2021-09-05T20:07:46Z,Athiran,"What did you name the variable inside urls .py that you created? It should be ""urlpatterns""",neutral
774,,rHux0gMZ3Eg,Ugw7X_fZdJJ2p4mStVZ4AaABAg,2021-09-04T14:59:42Z,Ramu Poonjolai,Please disable background music,neutral
775,,rHux0gMZ3Eg,Ugz9e8MEmM_P_ahtnEp4AaABAg,2021-09-04T10:12:00Z,Aysha,Watching Django tutorial on Youtube which was partially built with Django,negative
776,,rHux0gMZ3Eg,UgzdhscWa73ZGyCqfH54AaABAg,2021-09-04T09:32:54Z,SHAHAD HUSSEIN,"bin didn't show to me, i have lib, src, Scripts, but not bin, what do i do?",neutral
