,channel_id,video_id,comment_id,date,author,comment_text,sentiment
0,,rHux0gMZ3Eg,UgxCh3VTRWmOWudUtUx4AaABAg.9W3DO3jm6-V9rDwP-NBppM,2023-06-21T15:02:19Z,Franz Joseph Mendoza,"i have tried to buy the course but when i entered my visa in gpay (google pay?) and proceed it loads and after a while the page isn't working, but i think it didn't charge my account yet.",neutral
1,,rHux0gMZ3Eg,UgxCh3VTRWmOWudUtUx4AaABAg.9W3DO3jm6-V9r4HiwloBcG,2023-06-17T21:05:01Z,Superhero-Kaif,"Who the f**** voice over is this - this isn't Mosh and I kept getting feeling of "" my whole life is a lie"" because I had gone through several of your videos in the past especially your 6 hours python tutorial and you speak god damn American accent and this guy is speaking with asian accent - my brain just kept yelling something is wrong. Please introduce the lecturer if you are using another person to teach.",negative
2,,rHux0gMZ3Eg,UgxCh3VTRWmOWudUtUx4AaABAg.9W3DO3jm6-V9qUZGadS5kj,2023-06-03T05:27:09Z,shamshad malik,"hello Sir, i enrolled for this course. but forgot password .i am not able to recover as not not getting any recovery mail.i dont know if its a glitch. please ,i need immediate help as i am not able to watch the videos right now",negative
3,,rHux0gMZ3Eg,UgxCh3VTRWmOWudUtUx4AaABAg.9W3DO3jm6-V9qD-xHAYFJg,2023-05-27T09:51:27Z,Paulo Craice,"@Art - Brawl Starsgiven half of the internet seems 😮 powers by Wordpress, ignore PHP is very stupid.",negative
4,,rHux0gMZ3Eg,UgxCh3VTRWmOWudUtUx4AaABAg.9W3DO3jm6-V9lBR-QXJEtT,2023-01-22T12:32:22Z,Cody Sheridan,@SoberMan His full courses are well worth the money if you are serious about learning.,positive
5,,rHux0gMZ3Eg,UgyMBa0z3fFZkIg1IMJ4AaABAg,2023-06-22T20:52:38Z,Y.S.G TV,"please i need some help. When i was trying to map the url to the httpresponse i wasn't getting the string inputed but an error on the django page, what do i do?. I also got thesame error while using pycharm and I'm cofused",neutral
6,,rHux0gMZ3Eg,UgxisCqR8tsXHuSB-cd4AaABAg,2023-06-22T18:44:21Z,Aaron Royan,"Mosh i wanted to build a marketing website for commercial purposes.
At 35:51 you said templates arent used a lot. So am i going the right way using django. I didn't want to use angular and i wanted to switch to python for a change.
Let me know what you think",positive
7,,rHux0gMZ3Eg,UgzCxeaKcnnDQdyqYVp4AaABAg,2023-06-21T06:11:11Z,Syed Azeem Quadri,"heyy
after putting the path, I am not getting the extra directory of VScode.
can anyone help",neutral
8,,rHux0gMZ3Eg,Ugz8BkQIXMk6dhebUJl4AaABAg,2023-06-20T21:40:52Z,Reconbeatz,python interperter isnt working for me. i followed every step and i dont get the settings thing,neutral
9,,rHux0gMZ3Eg,Ugy-84_bxBLrraQKIrh4AaABAg,2023-06-20T06:33:37Z,ketty vaisbrot,"Hi, I get an error when i run the terminal after i did this parti n 31:55: ""include() missing 1 required positional argument: 'arg' "" although i followed all the steps from the video. what could be the problem?",negative
10,,rHux0gMZ3Eg,UgxUj4j4ERu4MIKmaUB4AaABAg.9r0eVWLWCRX9rH4wt2y5jQ,2023-06-22T20:23:27Z,Munish Reddy,I think you have to create a folder in playground folder and then html file inside the template folder. I also faced the same problem solved by creating template folder.,neutral
11,,rHux0gMZ3Eg,Ugzns_UJMbjAZHQgNHl4AaABAg,2023-06-15T20:29:38Z,Zombie Chicken,the .vscode folder isnt showing up in mine,neutral
12,,rHux0gMZ3Eg,Ugx_KuTbiXoHlbmhLYd4AaABAg,2023-06-14T17:50:55Z,kerim Tarik,why is there no giude on how to get Post put ore delete based on requests @programingwithmosh,neutral
13,,rHux0gMZ3Eg,UgxCtjs00Hs0nO_zeCp4AaABAg,2023-06-14T10:12:52Z,lesandu desilva,a super video . i learned django only from you. i am doing a job at google because of you. thank you. thank you.😇😇😃🥰🥰🥰🤩🤩‼‼,positive
14,,rHux0gMZ3Eg,Ugzr-APMPDGkzlMplMN4AaABAg,2023-06-14T02:25:24Z,Nguyen Duc Quoc Anh,Great tutorial! But the virtual environment stuff makes it unnecessarily distracting for beginners.,positive
15,,rHux0gMZ3Eg,UgwzoKi99RYRTvCubGd4AaABAg,2023-06-13T14:21:59Z,Olayele Gbenga Awujoola,I have been trying to make payment with my card since yesterday for the full course but it is not going through,positive
16,,rHux0gMZ3Eg,UgyZdkxeM48T2OxMxSN4AaABAg,2023-06-11T15:49:06Z,golowi,im a loser even w tutorial,neutral
17,,rHux0gMZ3Eg,UgyNEL_XW4cmPO5zegd4AaABAg,2023-06-09T11:36:28Z,SURPRISE MAWELA,Your tutoring skills are unmatched,neutral
18,,rHux0gMZ3Eg,Ugyn8ZZCjAs6TqaDTLd4AaABAg,2023-06-07T18:25:29Z,DON28ist,this guy is pretty good at marketing.,positive
19,,rHux0gMZ3Eg,UgxBLLX_EJi6PrUbDBl4AaABAg,2023-06-06T05:21:34Z,Ngolobane Ngozobolwane,My Favorite teacher,positive
20,,rHux0gMZ3Eg,UgxXfS_z8YNn3NNDKFN4AaABAg,2023-06-05T16:24:48Z,Daking Comzone,Mclaren not Ferrari 4:53,neutral
21,,rHux0gMZ3Eg,UgwZQYIcqthxma0SPsF4AaABAg,2023-06-03T08:49:29Z,chris padiga,"At 32:09 I'm getting ImportError: attempted relative import with no known parent package, any help?",neutral
22,,rHux0gMZ3Eg,Ugwz_01poxqQR6bB6sZ4AaABAg,2023-06-03T05:26:39Z,shamshad malik,"hello Sir, i enrolled for this course. but forgot password .i am not able to recover as not not getting any recovery mail.i dont know if its a glitch. please ,i need immediate help as i am not able to watch the videos right now",negative
23,,rHux0gMZ3Eg,UgztTGLrs4BKpdxp2nx4AaABAg,2023-06-01T07:12:42Z,Suganya Nagul,"Hi Mosh, I watched this tutorial in this while i'm installing django in virtual env I cannot able to find the bin file which you showed in 13.45.Can you please help",positive
24,,rHux0gMZ3Eg,UgzGyiMATTo8s5K9mxx4AaABAg,2023-05-29T22:45:32Z,Enochdgreat,Engineer Mosh. Please I love to purchase course but I neither have PayPal account nor Visa card. I'm from Nigeria. Please is there any other method of payment?,positive
25,,rHux0gMZ3Eg,UgzEyiEIjUm7yVZiCLZ4AaABAg,2023-05-29T19:28:33Z,ali zolfaghari,What is difference between django v3 and v4?,neutral
26,,rHux0gMZ3Eg,UgyfTg8--3sBgrOeSFx4AaABAg,2023-05-29T17:53:19Z,Mostafa Hasan,I just started. Good luck and have fun to mySelf😁😁,positive
27,,rHux0gMZ3Eg,UgzhBNj4IewHkxf6CQx4AaABAg,2023-05-29T12:00:10Z,ProgrammerOfHisLife,who knows what theme that is?,neutral
28,,rHux0gMZ3Eg,UgzC9JtPWjsyTloTOk54AaABAg,2023-05-28T15:10:07Z,g mh,Unable to pay for courses,negative
29,,rHux0gMZ3Eg,UgzR-xEMKBXTwi-pjzF4AaABAg,2023-05-26T07:36:39Z,Sachin Karki,while mapping url to views and starting the server it says module not found error: playground .plz some one help,neutral
30,,rHux0gMZ3Eg,Ugx1Yg5FlyiFCSP58L54AaABAg,2023-05-25T22:13:09Z,mat 86,I have a Asus intel core i3 labtop.,neutral
31,,rHux0gMZ3Eg,UgwT6Gxr6XVf-iefVqZ4AaABAg,2023-05-25T18:14:55Z,Oussama Tazi,"that is a mclaren my friend, not a ferrari",neutral
32,,rHux0gMZ3Eg,UgyB7ybvHLTQiXqIb594AaABAg,2023-05-25T14:09:09Z,Mohammad Ommshi,چه کردی پسر چه زبانی چه تدریسی آفرین بهت. کیف کردم,neutral
33,,rHux0gMZ3Eg,UgwnteRaaoFl9ViEdNF4AaABAg,2023-05-23T15:41:21Z,Nick Kingston,Where's the PC/Windows version for this? 14:00,neutral
34,,rHux0gMZ3Eg,UgwIiXgE_HEmHz9Hdk14AaABAg,2023-05-22T10:49:13Z,sanand n.r,"Why did sessions deleted, will it create trouble later? In app creation",negative
35,,rHux0gMZ3Eg,Ugz51tcPtYxDKz8UjP94AaABAg,2023-05-20T01:24:38Z,Ahmed Ifhaam,Anyone knows what icon pack he is using? seems quite nice and helpful,positive
36,,rHux0gMZ3Eg,UgyHMlUXQUBETksNWgl4AaABAg,2023-05-18T16:31:09Z,Momo Velia,"thank you mosh, I got my first job by your ultimate Django course :)",positive
37,,rHux0gMZ3Eg,UgwzUpVaID82UrXmAUF4AaABAg,2023-05-15T17:17:58Z,Faies Detect,Which is the VS code theme that you are using in this video?,neutral
38,,rHux0gMZ3Eg,UgyFsEW0OE4BbG3LL454AaABAg,2023-05-15T08:04:01Z,abdalla noufal,quick question in my terminal i cannot download anyhting so can i just download the package in pycharm or what can i do so i can download from terminal,positive
39,,rHux0gMZ3Eg,Ugz7vNFuPJKpWLNufph4AaABAg,2023-05-13T06:18:46Z,Balaji Ramadoss,"If you get ""pipenv: command not found"" error

Then run ""sudo -H pip3 install -U pipenv""",neutral
40,,rHux0gMZ3Eg,UgzRwuXO9PtOWvA_YNN4AaABAg,2023-05-11T17:14:21Z,Nicolas Edwards,i would love to subscribe to u because of how u seem to know what you are doing but that mac style just has me looking so much stuff up that its better if i just use forums. u sometimes forget to say what to do in the windows version as well and its not fulling me with enough confidence to take ur course sorry. just wish it had a separate 1 for strictly windows.,positive
41,,rHux0gMZ3Eg,Ugy2cqtfYQtn49Cjmw94AaABAg.9p_KYPYF8Dm9pbcn4sggA3,2023-05-12T12:09:13Z,Elahe Shabani,a folder is created on my desktop (Mac) but there is nothing inside it. Can someone help me with this?,neutral
42,,rHux0gMZ3Eg,UgzkI-aFtTP8VMzIptN4AaABAg,2023-05-10T23:56:50Z,Future,What’s Django I swear I thought movie 😢,neutral
43,,rHux0gMZ3Eg,UgxNDdL3NtsLiHPrZdN4AaABAg,2023-05-10T02:24:06Z,David Datica,It's incomplete. In the end it tries to sell you a paid course. Don't waste your time like I did.,negative
44,,rHux0gMZ3Eg,UgwfYuLHkgP8i8oTxM14AaABAg,2023-05-08T19:05:42Z,Sky grace,Mosh you're one of the teacher. Merci beaucoup.,neutral
45,,rHux0gMZ3Eg,UgwGhxLcnsq01doekjZ4AaABAg,2023-05-08T19:05:22Z,Sky grace,Mosh you're one of the teacher. Merci beaucoup.,neutral
46,,rHux0gMZ3Eg,Ugzd3kRv_OTNpkTsz8V4AaABAg,2023-05-08T11:09:22Z,Anthony Ryan,"No a full course
Its a sales video",negative
47,,rHux0gMZ3Eg,UgyWwh-RaXchACnIwwR4AaABAg,2023-05-06T18:28:37Z,Farad Ostovarnejad,"@mosh stand for mojtaba ?? no way we have a hamedani last name any where else , you must be iranian !!",neutral
48,,rHux0gMZ3Eg,UgxLwn8yyQWReHmvm-h4AaABAg,2023-05-06T11:03:05Z,ibrahim jaballa,how to do pip install in windows environment,neutral
49,,rHux0gMZ3Eg,UgyJ82QRjvWeUiG_7y94AaABAg,2023-05-04T12:08:32Z,Sangmo landry,You're a great teacher,positive
50,,rHux0gMZ3Eg,UgzdhGX8zAgAd147PGR4AaABAg,2023-05-04T07:29:23Z,Sueda,"why isnt there for windows users also, because not all commands are the same",neutral
51,,rHux0gMZ3Eg,UgyJE2xOlBvQ5u72PYh4AaABAg,2023-05-03T10:02:32Z,Ashraful Momen Shuvo,You are my favourite teacher !!! ❤,neutral
52,,rHux0gMZ3Eg,UgwNhcZsH_7zC4Exgrd4AaABAg,2023-05-02T06:47:10Z,erfan M,شت حاجی تو ایرانی هستی,neutral
53,,rHux0gMZ3Eg,UgxfYr2x_CW3LP_IDol4AaABAg,2023-04-30T09:50:28Z,Makan Kananian,"fFor beginners out there, do not watch this course as your first course, go try different courses, and when you had enough confidence come back and watch this course, do not get me wrong, mosh is great! but in this course, he is starting to build a really big project and he did divide the project into smaller chunks, but the problem is for a big project those smaller chunks are pretty confusing by themselves. as example the admin site configuration in part 1 of Django series, he is going into too many details that will make your brains hurt. it is a good and excellent course but not for beginners!",positive
54,,rHux0gMZ3Eg,Ugzj2KJWJJGuEEz7U2h4AaABAg,2023-04-28T22:20:35Z,TRaGiC1068,everything broke at mapping urls... now I tried to backtrack and it wont even create new apps...,positive
55,,rHux0gMZ3Eg,UgwKX23EPY3Nz63o2854AaABAg,2023-04-28T15:11:09Z,Kosty Arnouk,I keep getting this zsh: command not found: pipenv,neutral
56,,rHux0gMZ3Eg,UgyZHVzosPo98Vv0YA54AaABAg,2023-04-28T12:05:12Z,Alpe Alfanta,"Hello Mosh,  Any other payment option?  I have no card though. Do you have customer chat support?",negative
57,,rHux0gMZ3Eg,UgxPGsITt5VNqmPWLtZ4AaABAg,2023-04-27T21:11:28Z,SCFD Tutorials,Using useless examples doesn't teach anything. Use real world examples specially with debug. I got nothing out of your debugging section.,positive
58,,rHux0gMZ3Eg,UgwUSU3QnbXMvPa9js54AaABAg,2023-04-26T10:54:02Z,Sniper Kyle,Great Tutorial especially because of the animations.,positive
59,,rHux0gMZ3Eg,Ugzuw2Ktb59KJKC9Ped4AaABAg,2023-04-17T05:14:25Z,Jeby,What's the theme and font of your vscode?,neutral
60,,rHux0gMZ3Eg,UgwOeij0M9jcpmODdYh4AaABAg,2023-04-15T16:23:03Z,Connor King,Mosh what Terminal add on are you using? The one that colours and formats the commands? Thank you!,neutral
61,,rHux0gMZ3Eg,Ugxw7mdzmM40sdgjDHd4AaABAg,2023-04-14T15:21:26Z,Moaz Jabban,i have a problem the  terminal keep telling me that there is no module named 'debug_toolbar,neutral
62,,rHux0gMZ3Eg,UgwYEWW6SS3cXT95mTN4AaABAg,2023-04-14T13:33:00Z,Gaming with Huzaifa,mosh you are amazing,positive
63,,rHux0gMZ3Eg,UgyZeAfAyXBEs9-p46d4AaABAg,2023-04-12T18:19:58Z,Amir A,"Dear Mosh, please provide updates regarding Bashing Course (Unix/Win). I need your bashing course.",neutral
64,,rHux0gMZ3Eg,Ugyl3Bv5jd2zU3IHIOV4AaABAg,2023-04-11T16:32:28Z,Kabukaluca,"VSCode does not find anything with ""python"" when going to: view / command palette / ... can anyone help me ?",neutral
65,,rHux0gMZ3Eg,UgxPUqblUeEHILm7sBp4AaABAg,2023-04-11T03:26:21Z,sa le,Thank you master ❤,neutral
66,,rHux0gMZ3Eg,Ugz1gwnivT8-v7h2Rm54AaABAg,2023-04-10T13:53:09Z,Abe Temitope,"Pls i have a question about python and Django, I built a countdown timer with python codes(it works on the terminal), pls is it possible to add it to my Django project as an app?
I don't want to use JavaScript to recreate the timer",neutral
67,,rHux0gMZ3Eg,Ugyem-rLmHeJwcQQVUt4AaABAg,2023-04-08T20:11:09Z,HighBrow IT /CS,Please next part of django course,neutral
68,,rHux0gMZ3Eg,Ugyq04CyTEb61kszSTJ4AaABAg,2023-04-07T20:48:03Z,Rabb,Would it be possible to learn Django without any python knowledge?,neutral
69,,rHux0gMZ3Eg,UgyIKAjK5d3JRCyCjR54AaABAg,2023-04-05T16:30:19Z,Black Tiger,"Windows Only:
If problem appears directly after opening the Terminal, because it cannot acces the Interpreter:
Run this command in Powershell (Start as administartor): Set-ExecutionPolicy -ExecutionPolicy RemoteSigned and type Y
Fixed it for me, hope i could help",positive
70,,rHux0gMZ3Eg,Ugxm9kT58ZCt1DEfTwp4AaABAg,2023-04-04T20:23:53Z,Vlad Palamarchuk,Too much advertising !,positive
71,,rHux0gMZ3Eg,UgxFJGHNI9Ek2eETl1p4AaABAg,2023-04-04T14:34:42Z,Lavanya setty,i am facing issue when i use runserver it says path not found,neutral
72,,rHux0gMZ3Eg,UgxF6S0yYPK9J8tTCSN4AaABAg,2023-04-03T11:36:58Z,Paid course for free,get the ultimate django course in my youtube channel,neutral
73,,rHux0gMZ3Eg,UgwaXyPxJWeI9KFP2dV4AaABAg,2023-04-01T16:29:17Z,Antonis Tsiapalis,"I've stuck at the debugging lesson. while i've entered the '9000', after debugging the starting development server remains at 8000. any help?",neutral
74,,rHux0gMZ3Eg,Ugw50PnHB4KToauQ59x4AaABAg,2023-03-31T23:28:18Z,mad's head,i just found you are an ah,neutral
75,,rHux0gMZ3Eg,UgxOZbRHtGph7unn04t4AaABAg,2023-03-28T23:44:01Z,Arashdeep Singh,"Hi Im using a mac and the step to add the path for the python interpreter does not create a .Vscode file in my storefornt directory, please let me know if you can help me to resolve this.",neutral
76,,rHux0gMZ3Eg,UgwQfXQpWPAgmevYL_N4AaABAg,2023-03-28T12:26:12Z,BerthaProt,"Great, does the course is updated to the latest django v4 ?",positive
77,,rHux0gMZ3Eg,Ugz7kd2Ue_XFOQO0SR14AaABAg,2023-03-27T05:14:37Z,Olanrewaju Dimeji,Someone the part one series is the same with one he uploaded here on YouTube how true is that ?,positive
78,,rHux0gMZ3Eg,UgwbpWOh9mCM3uCmGQV4AaABAg,2023-03-25T12:00:41Z,amir bgh,where are you from?,neutral
79,,rHux0gMZ3Eg,UgyC1RNjKNPvhcf_zIl4AaABAg,2023-03-25T09:29:05Z,Adams Oppong,Great teacher!,positive
80,,rHux0gMZ3Eg,UgxWSkMn6A7t8H9AjE54AaABAg,2023-03-25T08:36:51Z,Manav Shah,i am getting the error to set the path on VS code for virtual environment for windows could some one please help me with this,neutral
81,,rHux0gMZ3Eg,UgyGazqpsa-XM0xJuQh4AaABAg,2023-03-24T14:28:47Z,Ramzy Karam,I basically learned everything i need from this video,neutral
82,,rHux0gMZ3Eg,UgxMS2LDBxY7jgXdVZl4AaABAg,2023-03-23T22:11:10Z,Plenty Of Pooches,"BEWARE - Mosh is a scam - I bought his Mastering React course. The course told me to download a specific version of Node JS and React which is no longer supported. I therefore could not follow his videos at all. I sent a support note asking him to either update the course so that the technology is not out of date or refund my money. He didn't even have the decency to even respond to my request. Basically, he stole almost $200 of my money. I instead enrolled in a similar course on Udemy which was up-to-date and a great course. After this experience, I read a bunch of other reviews of this course and they all said the same thing. Please do not waste your money on any of Mosh's courses.",positive
83,,rHux0gMZ3Eg,Ugz9snl7ur2kVShqqi14AaABAg,2023-03-23T04:45:45Z,Jeff Vinter,The first tutorial I have watched from you Mosh and I am very much impressed. Awesome! Thank you very much!,positive
84,,rHux0gMZ3Eg,UgzXJ67Dzux09yI7uVp4AaABAg,2023-03-18T19:32:37Z,Aaryan Tiwari,18:57 venv by default,neutral
85,,rHux0gMZ3Eg,UgylB5kx5D0jucqkHid4AaABAg.9nOn26TcFjR9nOoXT-9-G2,2023-03-18T10:19:39Z,Momo Velia,at 20:18 I don't have that vscode file,neutral
86,,rHux0gMZ3Eg,UgxLrURPGeYMddTZZQd4AaABAg,2023-03-17T15:20:36Z,h3ck phy,what vscode theme is he using?,neutral
87,,rHux0gMZ3Eg,UgysIBLOxvo8ujnUyvZ4AaABAg,2023-03-16T14:04:41Z,petsol,"As per your recommendation, I tried to watch Django in one hour but the movie is unenjoyable in nearly 3x the normal speed... Wait, WTF is Python?",negative
88,,rHux0gMZ3Eg,Ugzz7fBgtSrsJWhwQN14AaABAg,2023-03-16T11:34:35Z,Ifeanyi Chielo,this link is not accessible for me,negative
89,,rHux0gMZ3Eg,UgxlORasBPSRzJ0mvU94AaABAg,2023-03-15T16:44:19Z,rande,"i cant get django-admin module whether inside or out of a venv. im also on windows so its really difficult to follow along, everything i type in cmd prompt returns ""blank is not recognized as internal/external command"" or ""no module named: blank"". please help i cant find the answer anywhere and really stuck. thank you",negative
90,,rHux0gMZ3Eg,UgxH9wRtdx46WWEFiU14AaABAg,2023-03-13T22:51:23Z,Cyrus Morrow,i cant even get pipenv install django to work,neutral
91,,rHux0gMZ3Eg,Ugwnw7Eu9zY20iMkLdJ4AaABAg.9n81TzCvB9q9nX1ZD6zVN4,2023-03-21T14:56:08Z,Younger Lei,"Hi, have you activated your virtual environment? If not, the ImportError may occur.",neutral
92,,rHux0gMZ3Eg,UgwyFx7y89Zx_7eMJAp4AaABAg,2023-03-11T05:48:38Z,Cursed Code,5:41 this guy's killing me,neutral
93,,rHux0gMZ3Eg,UgxAVkGqy5ipp4IQyml4AaABAg.9n0YAgEM1p-9qcKq3aa3X4,2023-06-06T15:14:14Z,RollOut,same for me .. can someone please help us,neutral
94,,rHux0gMZ3Eg,UgxAVkGqy5ipp4IQyml4AaABAg.9n0YAgEM1p-9nvrt5UMRlH,2023-03-31T15:43:08Z,Local Mexican,@Michele Nardin No I have been waiting this entire time still for an answer.,neutral
95,,rHux0gMZ3Eg,UgxAVkGqy5ipp4IQyml4AaABAg.9n0YAgEM1p-9nvotJ2x7TJ,2023-03-31T15:16:56Z,Michele Nardin,"Hello, I am getting the same error. I also tried restarting the project but it doesn't seem to work. Have yiu found out how to fix it?",neutral
96,,rHux0gMZ3Eg,UgwEwSMaerrI4nv-5qN4AaABAg,2023-03-07T18:40:34Z,ASMR VVR,it is getting error when we change the templates folder name to any other name why,negative
97,,rHux0gMZ3Eg,UgxlCgLVrtpyZkPCBkt4AaABAg,2023-03-03T18:19:52Z,HK.COLLECTION'S,"hiii, sir. what is wrong i don't know i face some error it say  ImportError: No module named django.urls please help me",negative
98,,rHux0gMZ3Eg,Ugxg1oVbjm26Xj15ueh4AaABAg,2023-03-03T08:11:06Z,Hamza Sajjad,Is this video enough for A Django beginner?,neutral
99,,rHux0gMZ3Eg,UgwCEiYpSbu4oSqI-Hh4AaABAg.9mkvMR5gjXy9mlM2aPjT0E,2023-03-02T17:12:24Z,Teleqram me @moshsupport,Teleqram me👆⬆️..,neutral
100,,rHux0gMZ3Eg,UgxO_i5d17UwFqFD_2t4AaABAg.9mhCZ9_SDWp9mlM4iqJlr_,2023-03-02T17:12:42Z,Teleqram me @moshsupport,Teleqram me👆⬆️..,neutral
101,,rHux0gMZ3Eg,UgxDwnhXEi-wLoKqhXJ4AaABAg.9mcFp_J8KrZ9mlM6pjt5rf,2023-03-02T17:12:59Z,Teleqram me @moshsupport,Teleqram me👆⬆️..,neutral
102,,rHux0gMZ3Eg,Ugxd7hY8ytX1G0f0iqh4AaABAg.9ma6VhKqz1V9mlM96Tb-F4,2023-03-02T17:13:17Z,Teleqram me @moshsupport,Teleqram me👆⬆️..,neutral
103,,rHux0gMZ3Eg,Ugxj0QQf_YV6JRnPkDt4AaABAg,2023-02-25T19:29:13Z,Predictions Girl,"Hi I am starting an ecommerce project in django , if anyone interested than msg me 

No paying 

Only prectice new project for learning",positive
104,,rHux0gMZ3Eg,Ugxdk7WrYWSZ8_IG6St4AaABAg.9mV7YekQqO19mlMKKLeb4F,2023-03-02T17:14:49Z,Teleqram me @moshsupport,Teleqram me.👆⬆️..,neutral
105,,rHux0gMZ3Eg,UgxkBnU6ampwPX54_954AaABAg.9mKJ9ebQF9V9mlMO7zsRtn,2023-03-02T17:15:20Z,Teleqram me @moshsupport,Teleqram me.👆⬆️..,neutral
106,,rHux0gMZ3Eg,UgwIuZuwJOL4Rxu5bGZ4AaABAg.9mIzPvlE0iI9mlMPI-VhzG,2023-03-02T17:15:30Z,Teleqram me @moshsupport,Teleqram me.👆⬆️..,neutral
107,,rHux0gMZ3Eg,UgwEMZilDQjVo_uyvVN4AaABAg.9mF-qg8Og1B9mlMQb9j076,2023-03-02T17:15:41Z,Teleqram me @moshsupport,Teleqram me.👆⬆️..,neutral
108,,rHux0gMZ3Eg,UgxLnWLWEiEAHAB0FNh4AaABAg.9mCOAjjA6pb9mlMa5g4Nng,2023-03-02T17:17:07Z,Teleqram me @moshsupport,Teleqram me.👆⬆️..,neutral
109,,rHux0gMZ3Eg,UgxLnWLWEiEAHAB0FNh4AaABAg.9mCOAjjA6pb9mlMX4lDMEH,2023-03-02T17:16:34Z,Teleqram me @moshsupport,Teleqram me.👆⬆️..,neutral
110,,rHux0gMZ3Eg,Ugzgp8mHNB218HYo1XZ4AaABAg,2023-02-16T06:21:47Z,Reshma Sultana,I have a doubt. I am doing this project in Pycharm. Does pycharm create a virtual environment automatically? Or do we need to activate the environment like how you created?,neutral
111,,rHux0gMZ3Eg,Ugy5WGpWLktwVQFedtN4AaABAg.9mAMEzeriZX9mlMdPUNAs7,2023-03-02T17:17:34Z,Teleqram me @moshsupport,Teleqram me.👆⬆️..,neutral
112,,rHux0gMZ3Eg,UgweRq75KFQOiPnRfU54AaABAg.9mA4iJneZVu9mlMeaxd6qu,2023-03-02T17:17:44Z,Teleqram me @moshsupport,Teleqram me.👆⬆️..,neutral
113,,rHux0gMZ3Eg,UgyMV9wtTnNEA53Kscl4AaABAg.9m4j35egQMU9mlMh696QPJ,2023-03-02T17:18:04Z,Teleqram me @moshsupport,Teleqram me.👆⬆️..,neutral
114,,rHux0gMZ3Eg,UgyMV9wtTnNEA53Kscl4AaABAg.9m4j35egQMU9mMKpzYW5SW,2023-02-20T14:41:33Z,Fayis Majeed,Yes same problem? Did you get it,neutral
115,,rHux0gMZ3Eg,UgwKAoZttQGMlC5oF354AaABAg,2023-02-12T14:21:39Z,Hugo Montana,Absolute waste of time,neutral
116,,rHux0gMZ3Eg,UgxYr4YVu9FaC4RuFPt4AaABAg.9m0wAQuWOQd9mlMlLOCrBh,2023-03-02T17:18:39Z,Teleqram me @moshsupport,Teleqram me.👆⬆️..,neutral
117,,rHux0gMZ3Eg,UgwcHe0V1t9mY7uZJYh4AaABAg.9m-nQwgEJae9mlMnLwq8lv,2023-03-02T17:18:55Z,Teleqram me @moshsupport,Teleqram me.👆⬆️..,neutral
118,,rHux0gMZ3Eg,Ugx84SiziTmjswUuGCt4AaABAg.9m-LbbPRumg9mlMpYOiZSa,2023-03-02T17:19:13Z,Teleqram me @moshsupport,Teleqram me.👆⬆️..,neutral
119,,rHux0gMZ3Eg,Ugy1gwsFRC7VcxWP0hN4AaABAg,2023-02-11T15:39:51Z,Dama Luke,"Hi Mosh, I wanna know why can't I create the .vscode folder after selected the interpreter?",neutral
120,,rHux0gMZ3Eg,UgyfbbbPvCddgXMFtiZ4AaABAg.9m--53fgEQY9mlMrv4jrcL,2023-03-02T17:19:33Z,Teleqram me @moshsupport,Teleqram me.👆⬆️..,neutral
121,,rHux0gMZ3Eg,UgwXTEwre125zcbhLYl4AaABAg.9lzIHSgOFla9mlMug2HGYS,2023-03-02T17:19:55Z,Teleqram me @moshsupport,Teleqram me.👆⬆️..,neutral
122,,rHux0gMZ3Eg,Ugzni_L67kLfKxbRfkx4AaABAg.9lwqqqZ0p559mlMyA2TiEu,2023-03-02T17:20:24Z,Teleqram me @moshsupport,Teleqram me.👆⬆️..,neutral
123,,rHux0gMZ3Eg,Ugz1vDQHsXIiAKKg36V4AaABAg.9luQSylAS7c9mlN-U5UibV,2023-03-02T17:20:43Z,Teleqram me @moshsupport,Teleqram me.👆⬆️..,neutral
124,,rHux0gMZ3Eg,UgxDn4EsTtEUm2uJ9yt4AaABAg.9ltAr45GM9j9mlN1M74hdZ,2023-03-02T17:20:58Z,Teleqram me @moshsupport,Teleqram me.👆⬆️..,neutral
125,,rHux0gMZ3Eg,UgwFIoq7YNPgb4oAzpJ4AaABAg.9lt28HnD4989mlN2rfg1_m,2023-03-02T17:21:11Z,Teleqram me @moshsupport,Teleqram me.👆⬆️..,neutral
126,,rHux0gMZ3Eg,UgwvRdcjLxyzFznWmiJ4AaABAg,2023-02-08T17:13:44Z,Rajeshwar Choudhary,following all the steps however the .vscode at 20.19 is not showing up. what i may be doing wrong?,negative
127,,rHux0gMZ3Eg,UgzYH21S3JBWHfn5r-F4AaABAg.9ls5kw8mwVc9mlN41vYMPB,2023-03-02T17:21:20Z,Teleqram me @moshsupport,Teleqram me.👆⬆️..,neutral
128,,rHux0gMZ3Eg,UgyaKVRuE2Re-6aRGyh4AaABAg,2023-02-07T21:06:41Z,Inner Threat Circus,"pipenv is never creating a bin directory after executing the install django and there's no error. it creates a bunch of other files and directories. I resinstalled pipenv, python, vscode all entirely, can't get through this. :(",negative
129,,rHux0gMZ3Eg,UgxfFfJ1lRKJzKnZ4O14AaABAg,2023-02-07T14:33:14Z,Relaxing Music,"cant follow your instructions, you just saying stuff we have to do, but dont show how where ...",neutral
130,,rHux0gMZ3Eg,UgxA0Bm2FqIHcCONwW54AaABAg,2023-02-07T10:16:20Z,Relaxing Music,"5:53 , here in the US,? , dont you live in Australia?",positive
131,,rHux0gMZ3Eg,Ugzh-31WGsgqbkCyv7l4AaABAg,2023-02-07T07:57:19Z,Sk_Rony,I am still a student. But it is interesting to learn this language,positive
132,,rHux0gMZ3Eg,Ugx8m_iqqhfck0f5X9d4AaABAg.9llH4rHJAcg9mlNAA6CXci,2023-03-02T17:22:10Z,Teleqram me @moshsupport,Teleqram me.👆⬆️..,neutral
133,,rHux0gMZ3Eg,UgzZm7JNX6ZZToQc_AN4AaABAg.9lctuU1N7ui9lgVu062CSS,2023-02-03T23:30:53Z,First Last,"did you just copy paste your folder, or did you paste the the pipenv --venv generated from being in the folder? Yo.u need the pipenv --venv address to have the integrated terminal is vs code",neutral
134,,rHux0gMZ3Eg,UgyokZk1E_QwcphMB2R4AaABAg.9lbLNqYgVs59mlNC0Oci7A,2023-03-02T17:22:26Z,Teleqram me @moshsupport,Teleqram me.👆⬆️..,neutral
135,,rHux0gMZ3Eg,UgxYPsPkRw91xczZAXh4AaABAg.9lTqu6QWy7r9mlNIr_FW-e,2023-03-02T17:23:22Z,Teleqram me @moshsupport,Teleqram me.👆⬆️..,neutral
136,,rHux0gMZ3Eg,Ugzvp1bGV8Ppxa2Qyxp4AaABAg.9lTGCJzAFCG9mlNHJoRUev,2023-03-02T17:23:09Z,Teleqram me @moshsupport,Teleqram me.👆⬆️..,neutral
137,,rHux0gMZ3Eg,UgySDVtS_Bgr62KQAZp4AaABAg.9lQIRP0bZqb9mlNGCrWNCL,2023-03-02T17:23:00Z,Teleqram me @moshsupport,Teleqram me.👆⬆️..,neutral
138,,rHux0gMZ3Eg,UgyJLqGwdcZIU1-a_Sp4AaABAg,2023-01-28T03:54:39Z,spianny,"nothing is showing up in my .vscode ... settings.json folder
help me please",neutral
139,,rHux0gMZ3Eg,Ugzdpy3WsH60vYYHtul4AaABAg.9lOde8V1B3K9mlNKZ1KI7U,2023-03-02T17:23:35Z,Teleqram me @moshsupport,Teleqram me.👆⬆️..,neutral
